Cites,Authors,Title,Year,Source,Publisher,ArticleURL,CitesURL,GSRank,QueryDate,Type,DOI,ISSN,CitationURL,Volume,Issue,StartPage,EndPage,ECC,CitesPerYear,CitesPerAuthor,AuthorCount,Age,Abstract,FullTextURL,RelatedURL
0,"AJG Gutiérrez","REGIONALISMO Y FRAGMENTACIÓN REGIONAL EN AMÉRICA LATINA: EL PAPEL ACTUAL DE LA CELAC HACIA UNA NUEVA INTEGRACIÓN DES …",2019,"Revista Espirales","revistas.unila.edu.br","https://revistas.unila.edu.br/espirales/article/view/1716","",321,"2025-10-17 11:37:31","","","","",,,,,0,0.00,0,1,6,"… de Estados Latino-Americanos e Caribenhos (CELAC) desempenha um papel importante na … uma abordagem fundamental para uma redefinição da CELAC como o maior espaço de …","https://revistas.unila.edu.br/espirales/article/view/1716/1602","https://scholar.google.com/scholar?q=related:wiYicN-vEbsJ:scholar.google.com/&scioq=intitle:celac&hl=en&as_sdt=2007"
0,"R Medina Peña, G Vivanco Vargas…","La integración latinoamericana desde la normatividad ambiental: desafíos de la Comunidad de Estados Latinoamericanos y Caribeños (CELAC).",2018,"… Educación, Política y …","search.ebscohost.com","https://search.ebscohost.com/login.aspx?direct=true&profile=ehost&scope=site&authtype=crawler&jrnl=20077890&AN=127823802&h=YHLwSsZq8Zflj4lRwA3i8mmHPbuoAOYC3ybkQMgMCTEO9dqgQimnX7jIlytzB42WkecIAzWAwz7xI4COeGJP3w%3D%3D&crl=c","",322,"2025-10-17 11:37:31","","","","",,,,,0,0.00,0,3,7,"El presente artículo aborda el tema que en el contexto internacional suscita gran interés y debate, específicamente la integración latinoamericana desde la normatividad ambiental. El …","","https://scholar.google.com/scholar?q=related:fQctiqnK1eAJ:scholar.google.com/&scioq=intitle:celac&hl=en&as_sdt=2007"
0,"AK Uribe Escalante","… en el sistema mundo del siglo XXI: los regionalismos en clave geopolítica: el caso de la comunidad de Estados Latinoamericanos y Caribeños (CELAC)",2021,"","ru.dgb.unam.mx","https://ru.dgb.unam.mx/bitstreams/7f0cbbf6-2179-4424-80f2-6f7445629945/download","",323,"2025-10-17 11:37:31","PDF","","","",,,,,0,0.00,0,1,4,"… Por todo lo anterior, está investigación intenta a lo largo de sus páginas cumplir con el objetivo de realizar una reflexión teórica y política, para plantear un balance crítico sobre …","https://ru.dgb.unam.mx/bitstreams/7f0cbbf6-2179-4424-80f2-6f7445629945/download","https://scholar.google.com/scholar?q=related:F-PxbduB2IoJ:scholar.google.com/&scioq=intitle:celac&hl=en&as_sdt=2007"
0,"E DREON","… válida para el desarrollo. Un enfoque regional de la seguridad alimentaria a la luz de la Agenda 2030 para el Desarrollo Sostenible CELAC as a valid …",,"III Congreso Internacional de Estudios del Desarrollo","zaguan.unizar.es","https://zaguan.unizar.es/record/64355/files/BOOK-2018-003.pdf#page=17","",325,"2025-10-17 11:37:31","PDF","","","",,,,,0,0.00,0,1,,"Frente a los nuevos desafíos surgidos en el nuevo siglo sumado a los ya existentes como es el caso de la inseguridad alimentaria y la erradicación del hambre, los países integrantes …","https://zaguan.unizar.es/record/64355/files/BOOK-2018-003.pdf#page=17","https://scholar.google.com/scholar?q=related:PdYbjhjfP4IJ:scholar.google.com/&scioq=intitle:celac&hl=en&as_sdt=2007"
0,"I PRESENTACION","… SALUD Y SEGURIDAD DE LOS TRABAJADORES” EN LOS PAÍSES DE LA COMUNIDAD DE ESTADOS LATINOAMERICANOS Y CARIBEÑOS (CELAC)",,"relatsargentina.com","","https://www.relatsargentina.com/documentos/RA.1-SST/RELATS.A.SST.SanJuan12.pdf","",326,"2025-10-17 11:37:31","PDF","","","",,,,,0,0.00,0,1,,"… comprometemos a desarrollar una ""Hoja de Ruta CELAC-UE sobre Seguridad y Salud en el … la puesta en funcionamiento de la CELAC. Es decir, que la CELAC la integran todos los …","https://www.relatsargentina.com/documentos/RA.1-SST/RELATS.A.SST.SanJuan12.pdf","https://scholar.google.com/scholar?q=related:oUBtQIH0xJcJ:scholar.google.com/&scioq=intitle:celac&hl=en&as_sdt=2007"
0,"K Dykmann, NHK Hede","¿ Un desafío contra-hegemónico en el hemisferio occidental? Las relaciones entre China y CELAC (2008-2018)",2025,"… sobre letras, historia y sociedad. Notas …","dialnet.unirioja.es","https://dialnet.unirioja.es/servlet/articulo?codigo=10119868","",328,"2025-10-17 11:37:31","","","","",,,,,0,0.00,0,2,1,"… We ask whether China has utilized CELAC as a counter-hegemonic challenge to US … multilateral institutions to CELAC. We argue that China’s engagement with CELAC functioned as …","","https://scholar.google.com/scholar?q=related:1Dovlg4VSjwJ:scholar.google.com/&scioq=intitle:celac&hl=en&as_sdt=2007"
0,"JA Sanahuja Perales","Enfoques diferenciados y marcos comunes en el regionalismo latinoamericano: Alcance y perspectivas de UNASUR y CELAC",2014,"","docta.ucm.es","https://docta.ucm.es/entities/publication/af4c464c-4c5a-41b0-bc67-49f41684435b","",329,"2025-10-17 11:37:31","","","","",,,,,0,0.00,0,1,11,"Este artículo analiza las dinámicas de cambio en el regionalismo y la integración regional en América Latina desde mediados de 2005. La región presenta un escenario complejo y …","https://docta.ucm.es/bitstreams/8c5890cd-e8f2-4999-81c3-452999487682/download","https://scholar.google.com/scholar?q=related:h4k84FA15uoJ:scholar.google.com/&scioq=intitle:celac&hl=en&as_sdt=2007"
0,"MM Domínguez Bogado","El término America Latina como estrategia de integración política regional de la unasur y la Celac analizada a partir de la frontera compartida entre Argentina, Brasil y …",2016,"","dspace.unila.edu.br","https://dspace.unila.edu.br/items/8f430155-4a4f-41cf-adbe-0d0234a2a462","",332,"2025-10-17 11:37:31","","","","",,,,,0,0.00,0,1,9,"El presente proyecto de investigación intentará explicar cómo en las últimas dos décadas el término de América Latina es utilizado dentro de los nuevos paradigmas de integración …","","https://scholar.google.com/scholar?q=related:K2oXqOpObnwJ:scholar.google.com/&scioq=intitle:celac&hl=en&as_sdt=2007"
0,"J Vivar, R Gajate","Intergubernamentalismo y seguridad alimentaria de alimentos sin gluten en el MERCOSUR y la CELAC",2020,"Investigación Joven","revistas.unlp.edu.ar","https://revistas.unlp.edu.ar/InvJov/article/view/11792","",333,"2025-10-17 11:37:31","","","","",,,,,0,0.00,0,2,5,"En la investigación que se propone, se indagará, teniendo como marco el intergubernamentalismo de la región de América Latina, el tratamiento en materia de seguridad alimentaria y …","","https://scholar.google.com/scholar?q=related:GD7seEYVg7EJ:scholar.google.com/&scioq=intitle:celac&hl=en&as_sdt=2007"
0,"J Velasquez","Stärkt samarbetet mellan EU och CELAC",2013,"Fria tidningen","diva-portal.org","https://www.diva-portal.org/smash/record.jsf?pid=diva2:661551","",334,"2025-10-17 11:37:31","","","","",,,,,0,0.00,0,1,12,"Den 26 och 27 januari 2013 möttes EU: s och CELAC: s 43 regeringsföreträdare i det första mötet mellan de båda blocken i Santiago de Chile. Juan Velasquez menar att ett stärkt …","","https://scholar.google.com/scholar?q=related:bBlan9kG8IMJ:scholar.google.com/&scioq=intitle:celac&hl=en&as_sdt=2007"
0,"J Rios Sierra","… a La Cumbre Celac-UE De Santiago De Chile. Expectativas De Una Asociación Estratégica Birregional (From LAC-EU Summit of Madrid to Celac-EU Summit of …",2013,"… LAC-EU Summit of Madrid to Celac-EU Summit of …","papers.ssrn.com","https://papers.ssrn.com/sol3/papers.cfm?abstract_id=2440827","",335,"2025-10-17 11:37:31","","","","",,,,,0,0.00,0,1,12,"Spanish Abstract: El artículo tiene como principal finalidad abordar el viraje que desde la VI Cumbre ALCUE de Madrid, celebrada en mayo de 2010, ha experimentado la relación …","https://papers.ssrn.com/sol3/Delivery.cfm?abstractid=2440827","https://scholar.google.com/scholar?q=related:4Y_1IYztoG4J:scholar.google.com/&scioq=intitle:celac&hl=en&as_sdt=2007"
0,"L ST-ONGE","… ET DIPLOMATIE: LES ACCORDS DU FORUM CHINE-COMMUNAUTÉ DES ÉTATS LATINO-AMÉRICAINS ET DES CARAÏBES (CELAC) 2015, VERS UN …",2016,"","archipel.uqam.ca","https://archipel.uqam.ca/8846/1/M14494.pdf","",336,"2025-10-17 11:37:31","PDF","","","",,,,,0,0.00,0,1,9,"… -CELAC … CELAC, propulsés par l'aide officielle chinoise, sont utilisés par les Chinois comme instrument diplomatique. À cette fin, nous explorerons la vision des accords ChineCELAC …","https://archipel.uqam.ca/8846/1/M14494.pdf","https://scholar.google.com/scholar?q=related:k_cgSyyySEkJ:scholar.google.com/&scioq=intitle:celac&hl=en&as_sdt=2007"
0,"LF Ayerbe","alba, UnasUr y celac: El regionalismo latinoamericano en la percepción de think tanks de Estados Unidos",,"Anuario de la integración latinoamericana y caribeña …","academia.edu","https://www.academia.edu/download/78512951/Anuario-de-la-integracion-2011.pdf#page=268","",337,"2025-10-17 11:37:31","PDF","","","",,,,,0,0.00,0,1,,"… Bush, y concluimos con el significado atribuido a la CELAC, … de los miembros de la CELAC a favor de retomar las … los análisis sobre la creación de la CELAC: el acuerdo de integración …","https://www.academia.edu/download/78512951/Anuario-de-la-integracion-2011.pdf#page=268","https://scholar.google.com/scholar?q=related:hoe7cPwPQeQJ:scholar.google.com/&scioq=intitle:celac&hl=en&as_sdt=2007"
0,"JAQ Flores","Significados de la primera Cumbre celac-ue de Santiago de Chile 2013: Un paso atrás o dos pasos adelante en la construcción de la asociación estratégica Euro …",2015,"InterNaciones","internaciones.cucsh.udg.mx","https://www.internaciones.cucsh.udg.mx/index.php/inter/article/view/6858","",338,"2025-10-17 11:37:31","","","","",,,,,0,0.00,0,1,10,"El presente documento examina los principales significados y resultados de la Cumbre de la Comunidad de Estados Latinoamericanos y Caribeños y la Unión Europea (celac-ue), de …","https://www.internaciones.cucsh.udg.mx/index.php/inter/article/download/6858/5879","https://scholar.google.com/scholar?q=related:kbn1q3KuKUsJ:scholar.google.com/&scioq=intitle:celac&hl=en&as_sdt=2007"
0,"A UDUALC","… de Universidades de América Latina y el Caribe: sobre el Encuentro Universitario Ministerial de la Comunidad de Estados Latinoamericanos y Caribeños (CELAC)",2020,"","dspaceudual.org","http://dspaceudual.org/handle/Rep-UDUAL/771","",339,"2025-10-17 11:37:31","","","","",,,,,0,0.00,0,1,5,"Declaración oficial que emiten los rectores, rectoras y académicos de la UDUAL convocados al Encuentro Universitario Ministerial de la CELAC, e invitados por la Unión de …","http://dspaceudual.org/bitstream/Rep-UDUAL/771/1/Declaraci%C3%B3n%20CELAC%2001062020.pdf","https://scholar.google.com/scholar?q=related:vlZZ-dLLvZwJ:scholar.google.com/&scioq=intitle:celac&hl=en&as_sdt=2007"
0,"DB Baista","De Champlain a Trudeau y un poco más. Proyecciones de Canadá hacia América Latina y el Caribe: la Celac y el Caso Cuba",2015,"Cuadernos del Caribe","revistas.unal.edu.co","https://revistas.unal.edu.co/index.php/ccaribe/article/view/53878","",341,"2025-10-17 11:37:31","","","","",,,,,0,0.00,0,1,10,"El presente artículo arroja luz sobre las relaciones históricas de Canadá con América Latina y el Caribe–especialmente Cuba–desde momentos en que los actuales países de la …","https://revistas.unal.edu.co/index.php/ccaribe/article/download/53878/54940","https://scholar.google.com/scholar?q=related:aA5wdqgTGqsJ:scholar.google.com/&scioq=intitle:celac&hl=en&as_sdt=2007"
0,"DB Batista","De Champlain a Trudeau y un poco más. Proyecciones de Canadá hacia América Latina y el Caribe: la CELAC y el caso Cuba",,"Cuadernos del","revistas.unal.edu.co","https://revistas.unal.edu.co/index.php/ccaribe/issue/download/4485/814#page=43","",343,"2025-10-17 11:37:31","PDF","","","",,,,,0,0.00,0,1,,"El presente artículo arroja luz sobre las relaciones históricas de Canadá con América Latina y el Caribe–especialmente Cuba–desde momentos en que los actuales países de la …","https://revistas.unal.edu.co/index.php/ccaribe/issue/download/4485/814#page=43","https://scholar.google.com/scholar?q=related:GE-ZamOTlFoJ:scholar.google.com/&scioq=intitle:celac&hl=en&as_sdt=2007"
0,"M Mondélice","… nationales des droits de l'homme et des ombudsmans à l'appropriation des valeurs visant une meilleure gouvernance dans les relations UE-CELAC",2019,"Études caribéennes","journals.openedition.org","https://journals.openedition.org/etudescaribeennes/15155","",344,"2025-10-17 11:37:31","HTML","","","",,,,,0,0.00,0,1,6,"Ces dernières années, les relations entre la région Amérique latine et Caraïbe et l’Union européenne ont emprunté de nouvelles voies. Désormais, celles-ci misent particulièrement sur …","https://journals.openedition.org/etudescaribeennes/15155","https://scholar.google.com/scholar?q=related:Z2sFqUGgkpwJ:scholar.google.com/&scioq=intitle:celac&hl=en&as_sdt=2007"
0,"ЛВ Хадорич","СЕЛАК И БРИКС: КОНТУРЫ ГЛОБАЛЬНОГО ПАРТНЕРСТВА CELAC AND BRICS: OUTLINES OF A GLOBAL PARTNERSHIP",2020,"… издании, были представлены на рецензию с 01 …","researchgate.net","https://www.researchgate.net/profile/Nadezda-Konyushikhina/publication/364824370_VOSSTANIE_KOMUNEROS_V_NOVOJ_KASTILII_V_NARODNOJ_PAMATI_ISPANCEV_XVI_VEKA_LA_GUERRA_DE_LAS_COMUNIDADES_EN_CASTILLA_LA_NUEVA_REFLEJADA_EN_LA_MEMORIA_POPULAR_DE_LOS_ESPANOLES_DEL_SIGLO_XVI/links/635c34bf96e83c26eb6158e9/VOSSTANIE-KOMUNEROS-V-NOVOJ-KASTILII-V-NARODNOJ-PAMATI-ISPANCEV-XVI-VEKA-LA-GUERRA-DE-LAS-COMUNIDADES-EN-CASTILLA-LA-NUEVA-REFLEJADA-EN-LA-MEMORIA-POPULAR-DE-LOS-ESPANOLES-DEL-SIGLO-XVI.pdf#page=659","",345,"2025-10-17 11:37:31","PDF","","","",,,,,0,0.00,0,1,5,"La ponencia tiene como objetivo considerar los principales vectores de cooperación entre BRICS y CELAC, así como evaluar la importancia global de tales interacciones y sus …","https://www.researchgate.net/profile/Nadezda-Konyushikhina/publication/364824370_VOSSTANIE_KOMUNEROS_V_NOVOJ_KASTILII_V_NARODNOJ_PAMATI_ISPANCEV_XVI_VEKA_LA_GUERRA_DE_LAS_COMUNIDADES_EN_CASTILLA_LA_NUEVA_REFLEJADA_EN_LA_MEMORIA_POPULAR_DE_LOS_ESPANOLES_DEL_SIGLO_XVI/links/635c34bf96e83c26eb6158e9/VOSSTANIE-KOMUNEROS-V-NOVOJ-KASTILII-V-NARODNOJ-PAMATI-ISPANCEV-XVI-VEKA-LA-GUERRA-DE-LAS-COMUNIDADES-EN-CASTILLA-LA-NUEVA-REFLEJADA-EN-LA-MEMORIA-POPULAR-DE-LOS-ESPANOLES-DEL-SIGLO-XVI.pdf#page=659","https://scholar.google.com/scholar?q=related:ALG9kFKZtkMJ:scholar.google.com/&scioq=intitle:celac&hl=en&as_sdt=2007"
0,"D Rogatyuk","Latin America's CELAC summit pushes back against US power",2016,"Green Left","search.informit.org","https://search.informit.org/doi/abs/10.3316/informit.835935119506696","",346,"2025-10-17 11:37:31","","10.3316/informit.835935119506696","","",,,,,0,0.00,0,1,9,"… the summit with a statement on the goals of CELAC in eradicating poverty, fighting climate change, … A January 27 meeting featured representatives from all 33 CELAC member states. …","","https://scholar.google.com/scholar?q=related:1Y1vrRK0UiQJ:scholar.google.com/&scioq=intitle:celac&hl=en&as_sdt=2007"
0,"NI Millahueique Pezoa","Integración regional, autonomía e identidad cultural en América Latina: Los casos del ALBA-TCP, CELAC y UNASUR (2001-2015)",2020,"","datosdeinvestigacion.conicet.gov.ar","https://datosdeinvestigacion.conicet.gov.ar/handle/11336/214685","",347,"2025-10-17 11:37:31","","","","",,,,,0,0.00,0,1,5,"Durante los primeros quince años del nuevo milenio, se dieron una serie de fenómenos políticos y geopolíticos que han tenido impacto a nivel global. Dado el contexto mundial de …","","https://scholar.google.com/scholar?q=related:_gg_siL0vkUJ:scholar.google.com/&scioq=intitle:celac&hl=en&as_sdt=2007"
0,"RL BORGO","… E TECNOLÓGICA SUL-SUL PARA PROMOVER AS ESTRATÉGIAS DE GESTÃO E REDUÇÃO DE DESASTRES DA UNASUL E CELAC. UMA PROPOSTA DE …",2015,"Revista Terceiro Incluído","revistas.ufg.br","https://revistas.ufg.br/teri/article/view/38773","",348,"2025-10-17 11:37:31","","","","",,,,,0,0.00,0,1,10,"A gestão de risco de desastres e políticas de redução, as estratégias e iniciativas políticas tradicionais intergovernamentais na América do Sul, América Latina e Caribe estão …","https://revistas.ufg.br/teri/article/download/38773/19557","https://scholar.google.com/scholar?q=related:9DkWw83SJEsJ:scholar.google.com/&scioq=intitle:celac&hl=en&as_sdt=2007"
0,"AA Susila","Kepentingan Nasional Tiongkok Dalam Kerjasama ChinaComunidad de Estados Latinoamericanos y Caribenos (CELAC) Forum tahun 2015",2019,"","repository.ub.ac.id","https://repository.ub.ac.id/171361/","",349,"2025-10-17 11:37:31","","","","",,,,,0,0.00,0,1,6,"… melampuinya dengan menggunakan China - CELAC sebagai aktor baru dalam hubungan luar … dimana disini China menggunakan CELAC untuk mencapai kepentingan nasionalnya. …","","https://scholar.google.com/scholar?q=related:PGDYvfLvA1YJ:scholar.google.com/&scioq=intitle:celac&hl=en&as_sdt=2007"
0,"FJ Verdes-Montenegro Escanez, MV Álvarez…","Informe Iberoamérica 2025 IV Cumbre UE-CELAC en Colombia: retos y promesas",2025,"","docta.ucm.es","https://docta.ucm.es/entities/publication/340d602f-e4da-4067-b5af-ecb512aa1a99","",351,"2025-10-17 11:37:31","","","","",,,,,0,0.00,0,3,1,"La IVª cumbre Unión Europea-CELAC, que tendrá lugar en Santa Marta (Colombia), los días 9 y 10 de noviembre de 2025, dará continuidad al diálogo político de alto nivel que se …","https://docta.ucm.es/bitstreams/976e17b2-239b-422f-9c44-144b5992c6a6/download","https://scholar.google.com/scholar?q=related:Vc2Tdv0sIEwJ:scholar.google.com/&scioq=intitle:celac&hl=en&as_sdt=2007"
0,"HY Hilzah","PERAN FAO DALAM CELAC PLAN FOR FOOD AND NUTRITION SECURITY AND ERADICATION OF HUNGER 2025 TERHADAP KETAHANAN …",2022,"","Universitas Hasanuddin","","",352,"2025-10-17 11:37:31","CITATION","","","",,,,,0,0.00,0,1,3,"","","https://scholar.google.com/scholar?q=related:liFaF76AyaQJ:scholar.google.com/&scioq=intitle:celac&hl=en&as_sdt=2007"
0,"F Ruiz, V Vyklický","Dynamiques dans les déclarations finales des Sommets UE-CELAC [Dynamics in the final declarations of EU-CELAC Summits]",2025,"","ideas.repec.org","https://ideas.repec.org/p/pra/mprapa/124323.html","",353,"2025-10-17 11:37:31","","","","",,,,,0,0.00,0,2,1,"This article offers an analysis of the final declarations of the EU-CELAC Summits. First, it examines the trends in the use of the terms “multilateralism” and “bilateralism.” Then, it looks at …","","https://scholar.google.com/scholar?q=related:E99m2EqMPq0J:scholar.google.com/&scioq=intitle:celac&hl=en&as_sdt=2007"
0,"MAE Calle, FE Carrión, AE Bonilla Soria","V Cumbre de la Comunidad de Estados Latinoamericanos y Caribeños-CELAC: momento actual y el rol del Ecuador",,"sidalc.net","","https://www.sidalc.net/search/Record/dig-falcsoandes-10469-10631/Description","",354,"2025-10-17 11:37:31","","","","",,,,,0,0.00,0,3,,"Con la participación de María Augusta Calle, presidenta de la Comisión de Soberanía, Integración, Relaciones Internacionales y Seguridad Integral de la Asamblea Nacional del …","","https://scholar.google.com/scholar?q=related:r2lmRNJNwSwJ:scholar.google.com/&scioq=intitle:celac&hl=en&as_sdt=2007"
0,"AS Tcach","Nuevas instancias de diálogo en América del Sur y América Latina: unasur, celac y el fin de la era unipolar",2013,"","rephip.unr.edu.ar","https://rephip.unr.edu.ar/bitstream/handle/2133/5682/Articulo%202%20-%20Revista%20Nro.%2015.pdf?sequence=3","",355,"2025-10-17 11:37:31","PDF","","","",,,,,0,0.00,0,1,12,"América del Sur y la CELAC en América Latina, se generan instancias de diálogo nunca antes observadas entre los Estados de la región. Estos procesos de integración y cooperación, …","https://rephip.unr.edu.ar/bitstream/handle/2133/5682/Articulo%202%20-%20Revista%20Nro.%2015.pdf?sequence=3","https://scholar.google.com/scholar?q=related:e5-elVxEjwQJ:scholar.google.com/&scioq=intitle:celac&hl=en&as_sdt=2007"
0,"A Aharonian","CELAC: comenzamos a vernos con nuestros propios ojos",2011,"Envío: publicación mensual del Instituto Histórico …","dialnet.unirioja.es","https://dialnet.unirioja.es/servlet/articulo?codigo=3839570","",356,"2025-10-17 11:37:31","","","","",,,,,0,0.00,0,1,14,"El 2 y 3 de diciembre se reunieron en Venezuela los gobiernos de todos los países latinoamericanos y caribeños. Daban un nuevo primer paso para la creación de la Comunidad de …","","https://scholar.google.com/scholar?q=related:GjlX0wO7pBwJ:scholar.google.com/&scioq=intitle:celac&hl=en&as_sdt=2007"
0,"LP Báez","China's Foreign Policy in Latin America and Its Impact in Regionalintegration CELAC in the 21st Century",2017,"","山东大学","","",357,"2025-10-17 11:37:31","CITATION","","","",,,,,0,0.00,0,1,8,"","","https://scholar.google.com/scholar?q=related:zB0X4GsVZu8J:scholar.google.com/&scioq=intitle:celac&hl=en&as_sdt=2007"
2,"BD CELAC-UE","Proposals to the Heads of State and Government of the CELAC-EU Summit 2015",,"","","","https://scholar.google.com/scholar?cites=873160366844409071&as_sdt=2005&sciodt=2007&hl=en",358,"2025-10-17 11:37:31","CITATION","","","",,,,,2,0.00,2,1,,"","","https://scholar.google.com/scholar?q=related:7_S1OboWHgwJ:scholar.google.com/&scioq=intitle:celac&hl=en&as_sdt=2007"
0,"ENEL DE DOCTORA, AT SÁNCHEZ…","LAS NUEVAS INICIATIVAS DE INTEGRACIÓN LATINOAMERICANA EN EL SIGLO XXI, UNASUR, ALBA-TCP Y CELAC: LA CONSTRUCCIÓN DE UNA …",,"ru.dgb.unam.mx","","https://ru.dgb.unam.mx/server/api/core/bitstreams/fbc3fb2f-4df9-41a2-84d3-c09c75a8ed1d/content","",359,"2025-10-17 11:37:31","TXT","","","",,,,,0,0.00,0,3,,"… Lo más notorio de la CELAC es que, a diferencia de las … caribeños pero con la presencia de EEUU y Canadá, ausentes en la CELAC. … de la CELAC) que parecieran …","https://ru.dgb.unam.mx/server/api/core/bitstreams/fbc3fb2f-4df9-41a2-84d3-c09c75a8ed1d/content","https://scholar.google.com/scholar?q=related:qI7Z_CsqKHsJ:scholar.google.com/&scioq=intitle:celac&hl=en&as_sdt=2007"
0,"RV Flores, R Domínguez","Palabras clave: Iniciativa Mérida, Estados Unidos, Cuba, Honduras, Cumbre de la Unidad, celac, Consejo de Seguridad, G20, COP16, Grupo de Río.",,"forointernacional.colmex.mx","","https://forointernacional.colmex.mx/index.php/fi/article/view/2183","",361,"2025-10-17 11:37:31","","","","",,,,,0,0.00,0,2,,"El artículo evalúa parcialmente la política exterior del gobierno de Felipe Calderón al confrontar los documentos oficiales que identifican los objetivos y las estrategias de esa política–…","https://forointernacional.colmex.mx/index.php/fi/article/download/2183/2173","https://scholar.google.com/scholar?q=related:-oz_EdMXu9gJ:scholar.google.com/&scioq=intitle:celac&hl=en&as_sdt=2007"
0,"NU CEPAL","Reunión de Cancilleres CELAC con FAO y CEPAL [álbum fotográfico]",2015,"","sidalc.net","https://www.sidalc.net/search/Record/dig-cepal-11362-45378/Description","",362,"2025-10-17 11:37:31","","","","",,,,,0,0.00,0,1,10,"Los Ministros de Relaciones Exteriores que componen en Cuarteto de la Comunidad de Estados Latinoamericanos y Caribeños (CELAC) se reunieron con los máximos …","","https://scholar.google.com/scholar?q=related:UfexyaBdEUUJ:scholar.google.com/&scioq=intitle:celac&hl=en&as_sdt=2007"
0,"S Collantes, G Alexandra","Los desafíos del regionalismo latinoamericano: Análisis de CELAC hacía la UE como mecanismo de concertación política",,"alicia.concytec.gob.pe","","https://alicia.concytec.gob.pe/vufind/Record/RPUC_39609289396ce7968ddfc6b6bf449241","",363,"2025-10-17 11:37:31","","","","",,,,,0,0.00,0,2,,"… CELAC-UE … CELAC hacia la UE. Por ello, se busca identificar y analizar los factores que influyen en que hasta la actualidad exista una relativa ineficacia de la concertación de CELAC. …","","https://scholar.google.com/scholar?q=related:LmLF8RTv75EJ:scholar.google.com/&scioq=intitle:celac&hl=en&as_sdt=2007"
0,"C Güemes","8.“Te quiero, pero sin compromiso”. Igualdad de género en la Cumbre UE-CELAC",2023,"Una asociación renovada","researchgate.net","https://www.researchgate.net/profile/Jose-Antonio-Sanahuja/publication/375278713_Una_asociacion_renovada_Balance_y_perspectivas_de_la_Cumbre_UE-CELAC_y_las_relaciones_euro-latinoamericanas/links/6545278dce88b87031c207d6/Una-asociacion-renovada-Balance-y-perspectivas-de-la-Cumbre-UE-CELAC-y-las-relaciones-euro-latinoamericanas.pdf#page=27","",364,"2025-10-17 11:37:31","PDF","","","",,,,,0,0.00,0,1,2,"Las sociedades en donde los cuidados no se asumen colectivamente y las desigualdades de género persisten, no solo resultan injustas, sino que empobrecen moral y …","https://www.researchgate.net/profile/Jose-Antonio-Sanahuja/publication/375278713_Una_asociacion_renovada_Balance_y_perspectivas_de_la_Cumbre_UE-CELAC_y_las_relaciones_euro-latinoamericanas/links/6545278dce88b87031c207d6/Una-asociacion-renovada-Balance-y-perspectivas-de-la-Cumbre-UE-CELAC-y-las-relaciones-euro-latinoamericanas.pdf#page=27","https://scholar.google.com/scholar?q=related:oFiscThfDHkJ:scholar.google.com/&scioq=intitle:celac&hl=en&as_sdt=2007"
0,"M Alaniz, H Pizarro","Agendas de integración Latinoamericana y Caribeña de la CELAC 2023 en medios digitales de la Argentina",,"América Latina y el mundo. Aproximaciones …","spanll.uoa.gr","https://www.spanll.uoa.gr/fileadmin/depts/spanll.uoa.gr/www/uploads/Dimosieyseis/LIBRO_FIEALC_ARGENTINA.pdf#page=112","",367,"2025-10-17 11:37:31","PDF","","","",,,,,0,0.00,0,2,,"… a la CELAC su decisión de suspender su participación, aduciendo que el … Además de considerar la relevancia de las Cumbres de la CELAC, … negó a votar a la Argentina en la …","https://www.spanll.uoa.gr/fileadmin/depts/spanll.uoa.gr/www/uploads/Dimosieyseis/LIBRO_FIEALC_ARGENTINA.pdf#page=112","https://scholar.google.com/scholar?q=related:7NULZoFiOzEJ:scholar.google.com/&scioq=intitle:celac&hl=en&as_sdt=2007"
